{
  "id": "JF-AUDIT-0002",
  "issue": "https://github.com/KAPCTEH/21.08reliz/issues/1",
  "title": "Unit-тест bootstrap merge выполняет браузерный фрагмент без window",
  "severity": "P2",
  "confidence": "high",
  "verification_status": "TEST_CONFIRMED",
  "module": "tests",
  "location": {
    "path": "tests/entity-bootstrap-merge-unit.cjs",
    "symbol": "vm.runInContext",
    "line": 30
  },
  "first_seen_commit": "f8e12ecee3e9371dea23c76913302db24050160d",
  "last_verified_commit": "8fc993ea9ac84c511845279b796f4fbacdff6435",
  "fact": "На baseline commit тест извлекал фрагмент до initialServerSeedChanges, куда входит экспорт window.JustFunServerStorageV3, но VM-контекст не определял window и падал с ReferenceError до assertions. В PR 14 добавлен изолированный window stub, отдельные assertions browser-export и обязательный запуск теста в Windows CI. Исправление включено в protected main 8fc993ea9ac84c511845279b796f4fbacdff6435; server-wins merge, удаление устаревших локальных записей, incremental audit и полный Windows gate на точном итоговом SHA завершились успешно.",
  "evidence": [
    "JF-EVID-0002",
    "JF-EVID-0014",
    "JF-EVID-0018"
  ],
  "impact": "Регрессия merge/bootstrap фактически не проверяется и даёт ложный красный результат, скрывая возможные реальные дефекты за ошибкой harness.",
  "reproduction": [
    "Выполнить node tests/entity-bootstrap-merge-unit.cjs."
  ],
  "minimal_fix": "Ограничить извлекаемый source-фрагмент проверяемыми функциями либо предоставить минимальный window stub и отдельную проверку export-контракта.",
  "verification_contract": [
    "entity-bootstrap-merge-unit проходит",
    "assertions merge/bootstrap реально выполняются",
    "изменение соседнего browser export не ломает harness"
  ],
  "fingerprint": "sha256:bfaf9fc200a64df72cc311072db147803d2c0a8cd4598a30e1c80a4f214ccfd9",
  "related": [
    "https://github.com/KAPCTEH/21.08reliz/pull/14"
  ],
  "owner": "@KAPCTEH",
  "status": "CLOSED"
}
