{
  "id": "JF-AUDIT-0006",
  "issue": "https://github.com/KAPCTEH/21.08reliz/issues/6",
  "title": "Source-only ZIP не самодостаточен для двух release-тестов",
  "severity": "P2",
  "confidence": "high",
  "verification_status": "TEST_CONFIRMED",
  "module": "ci",
  "location": {
    "path": "tests/installer-source-test.py",
    "symbol": "read_windows_workflow",
    "line": 20
  },
  "first_seen_commit": "f8e12ecee3e9371dea23c76913302db24050160d",
  "last_verified_commit": "8fc993ea9ac84c511845279b796f4fbacdff6435",
  "fact": "На baseline детерминированный source-only ZIP исключал .github, а два release-теста напрямую читали workflow и падали в изолированной распаковке. В PR 16 добавлен зафиксированный workflow-контракт: полный checkout требует его точного совпадения с реальным workflow, а source-only профиль использует fixture без внешних файлов. Исправление включено в protected main 8fc993ea9ac84c511845279b796f4fbacdff6435; source-only ZIP, installer suite, release regression, incremental audit и полный Windows gate на точном итоговом SHA прошли.",
  "evidence": [
    "JF-EVID-0007",
    "JF-EVID-0016",
    "JF-EVID-0018"
  ],
  "impact": "Получатель опубликованного source-only ZIP не может воспроизвести заявленные release-проверки только из содержимого архива; зелёный результат полного checkout не переносится на поставляемый артефакт.",
  "reproduction": [
    "Распаковать JUSTFUN-SOURCE-CLEAN-7.8.3-f8e12ec.zip в пустой каталог.",
    "Установить зависимости по lock-файлам.",
    "Выполнить python tests/installer-source-test.py и node tests/release-regression-v783.mjs.",
    "Проверить ошибки отсутствия .github/workflows/windows-native-783.yml."
  ],
  "minimal_fix": "Хранить проверяемую копию workflow-контракта внутри source-only области, требовать точного совпадения в полном checkout и использовать её как самостоятельный источник только при отсутствии .github.",
  "verification_contract": [
    "новый ZIP распаковывается в пустой каталог",
    "оба release-теста запускаются без внешних файлов",
    "оба теста завершаются с кодом 0",
    "allowlist, commit и blob hashes ZIP остаются подтверждёнными"
  ],
  "fingerprint": "sha256:f98003c7a2ea9de83208041a34446d441d4ddb2ead6204f3b18ec5b9a573891a",
  "related": [
    "JF-EVID-0006",
    "https://github.com/KAPCTEH/21.08reliz/pull/16"
  ],
  "owner": "@KAPCTEH",
  "status": "CLOSED"
}
